{
  "$schema": "https://json-schema.org/draft/2020-12/schema",
  "$id": "https://assess.avd-ops.dev/schemas/avd-remediation-plan/v1.json",
  "title": "avd-remediation-plan/v1: the ordered changes one assessment and its review call for (plan.json)",
  "description": "Contract C24, written by avd-current-state's assessment portal from a C21 report, its C23 review if there is one, and the method's remediation hints (C20). One item per finding to fix: the Fix rows of the review, or every non-pass check when there is no review. Each item cites what good is and why (avd-assess claims) and names the change: an avd-landing-zone parameter or setting, or manual with a code. It holds no names, IDs or free text, only the estate pseudonym, check IDs and public values, and works without the brain or avd-swarm, which may import it (optional extensions only). The method is avd-assess methods/remediation.md.",
  "type": "object",
  "required": ["schema", "estate", "plannedOn", "basis", "items"],
  "additionalProperties": false,
  "$defs": {
    "date": { "type": "string", "pattern": "^[0-9]{4}-[0-9]{2}-[0-9]{2}$" },
    "sha256": { "type": "string", "pattern": "^[0-9a-f]{64}$" },
    "publicValue": {
      "description": "A public value only: a SKU, a count, a boolean, a region. Never a name, prefix or address: a string starts with a letter and holds only letters, digits and underscores, so an address, a CIDR prefix or a hyphenated resource name can't pass.",
      "oneOf": [
        { "type": "string", "pattern": "^[A-Za-z][A-Za-z0-9_]{0,63}$" },
        { "type": "integer" },
        { "type": "boolean" }
      ]
    }
  },
  "properties": {
    "$schema": { "type": "string" },
    "schema": { "const": "avd-remediation-plan/v1" },
    "estate": { "type": "string", "pattern": "^est-[0-9a-f]{8}$", "description": "The same pseudonym as the C21 report" },
    "plannedOn": { "$ref": "#/$defs/date" },
    "basis": {
      "type": "object",
      "description": "What the plan came from: the SHA-256 of the C21 report's bytes, the C23 review's when there was one, and the method version the report ran",
      "required": ["assessment", "method"],
      "additionalProperties": false,
      "properties": {
        "assessment": { "$ref": "#/$defs/sha256" },
        "review": { "$ref": "#/$defs/sha256" },
        "method": { "type": "integer", "minimum": 1 },
        "landingZoneCommit": { "type": "string", "pattern": "^[0-9a-f]{40}$", "description": "The avd-landing-zone commit the lz-parameter and lz-setting changes refer to" }
      }
    },
    "items": {
      "type": "array",
      "description": "At most one item per check. 'order' runs 1, 2, 3 ... by the rule in avd-assess methods/remediation.md: gap, then warn, then unknown; then severity high, medium, low; then check ID. tests/check_contracts.py checks the example against it.",
      "items": {
        "type": "object",
        "required": ["order", "check", "plane", "outcome", "pillar", "severity", "claims", "change", "source"],
        "if": { "properties": { "outcome": { "const": "unknown" } } },
        "then": { "properties": { "change": { "properties": { "kind": { "const": "manual" }, "code": { "const": "collect-evidence" } } } } },
        "additionalProperties": false,
        "properties": {
          "order": { "type": "integer", "minimum": 1 },
          "check": { "type": "string", "pattern": "^asm-[a-z0-9-]{3,60}$" },
          "plane": { "enum": ["azure", "entra", "intune", "m365", "power-platform", "orchestrator"] },
          "outcome": { "enum": ["warn", "gap", "unknown"], "description": "The C21 outcome; a passing check never makes an item" },
          "pillar": { "enum": ["reliability", "security", "cost", "operations", "performance"] },
          "severity": { "enum": ["high", "medium", "low"] },
          "claims": {
            "type": "array",
            "minItems": 1,
            "description": "The check's avd-assess citations: what good is and why",
            "items": { "type": "string", "pattern": "^(ref:[a-z0-9][a-z0-9-]{1,63}#[A-Za-z0-9][A-Za-z0-9.:-]{0,63}|gap:[a-z0-9][a-z0-9-]{1,63})$" }
          },
          "source": { "enum": ["review-fix", "unreviewed"], "description": "review-fix: the reviewer chose Fix; unreviewed: the check has no review row (or there is no review), so a non-pass check is planned as a fix (as C23 says)" },
          "change": {
            "type": "object",
            "required": ["kind"],
            "additionalProperties": false,
            "properties": {
              "kind": { "enum": ["lz-parameter", "lz-setting", "manual"] },
              "plane": { "enum": ["azure", "entra", "intune", "m365", "power-platform", "orchestrator"] },
              "name": { "type": "string", "pattern": "^[a-z][A-Za-z0-9-]{2,60}$" },
              "from": { "$ref": "#/$defs/publicValue", "description": "The value the estate has now, when it is public and known" },
              "to": { "$ref": "#/$defs/publicValue" },
              "code": { "enum": ["collect-evidence", "rebuild-hosts", "remove-orphaned-devices", "private-value", "outside-landing-zone", "process", "no-known-change"] }
            },
            "allOf": [
              { "if": { "properties": { "kind": { "const": "manual" } } }, "then": { "required": ["code"], "properties": { "name": false, "from": false, "to": false } }, "else": { "required": ["name"], "properties": { "code": false } } },
              { "if": { "properties": { "kind": { "const": "lz-setting" } } }, "then": { "properties": { "from": false, "to": false } } }
            ]
          }
        }
      }
    },
    "extensions": {
      "type": "object",
      "description": "Optional, for upper layers only, keyed by namespace (contracts/README.md rule 1). A foundation reader ignores it.",
      "propertyNames": { "pattern": "^[a-z][a-z0-9-]{1,30}$" }
    }
  }
}
